Title,Abstract,StoreId,ArticleType,Authors,copyright,documentType,entryDate,language,languageOfSummary,placeOfPublication,pubdate,pubtitle,year,DocumentURL,startPage,FindACopy,Database,source_file
Monday Nite Footballers Commentary: Ed West: A Lesson In Little Extras: Ed West: A Lesson In Little Extras,"A native of Osawatomie, Kas. Graduate from Pittsburg State. Married, three children. Taught basic electricity, Lincoln high school in the early '60s. Likes to fish in the Kansas reservoirs and the Canadian...",2828400567,newspapers,"Nunnelly, James T", Copyright Kansas City Call 1987, Article," Oct 2, 1987", English, English," Kansas City, Missouri","Oct 2, 1987",The Call (1933-),1987,https://www2.lib.ku.edu/login?url=https://www.proquest.com/newspapers/monday-nite-footballers-commentary-ed-west-lesson/docview/2828400567/se-2?accountid=14556, 12,https://VV6TT6SY5C.search.serialssolutions.com?ctx_ver=Z39.88-2004&amp;ctx_enc=info:ofi/enc:UTF-8&amp;rfr_id=info:sid/ProQ%3Ahnpkansascitycall&amp;rft_val_fmt=info:ofi/fmt:kev:mtx:journal&amp;rft.genre=article&amp;rft.jtitle=The+Call+%281933-%29&amp;rft.atitle=Monday+Nite+Footballers+Commentary%3A+Ed+West%3A+A+Lesson+In+Little+Extras&amp;rft.au=Nunnelly%2C+James+T&amp;rft.aulast=Nunnelly&amp;rft.aufirst=James&amp;rft.date=1987-10-02&amp;rft.volume=&amp;rft.issue=&amp;rft.spage=12&amp;rft.isbn=&amp;rft.btitle=&amp;rft.title=The+Call+%281933-%29&amp;rft.issn=&amp;rft_id=info:doi/,"ProQuest Digital Collections, ProQuest Historical Newspapers: Global, ProQuest Historical Newspapers: Kansas City Call",ProQuestDocuments-2026-01-22(1).xls
Monday Nite Footballers: Tracy Cherry: Moving Up and Giving Back... Uniquely: Tracy Cherry: Moving Up and Giving Back... Uniquely,"""Moving up and giving back."" That was the theme for last week's Women's Day program at St. James Methodist church. More personally, the theme applies neatly to a brilliant, unusual, athletic, and...",2828398701,newspapers,"Nunnelly, Jim", Copyright Kansas City Call 1987, Article," Jun 5, 1987", English, English," Kansas City, Missouri","Jun 5, 1987",The Call (1933-),1987,https://www2.lib.ku.edu/login?url=https://www.proquest.com/newspapers/monday-nite-footballers-tracy-cherry-moving-up/docview/2828398701/se-2?accountid=14556, 13,https://VV6TT6SY5C.search.serialssolutions.com?ctx_ver=Z39.88-2004&amp;ctx_enc=info:ofi/enc:UTF-8&amp;rfr_id=info:sid/ProQ%3Ahnpkansascitycall&amp;rft_val_fmt=info:ofi/fmt:kev:mtx:journal&amp;rft.genre=article&amp;rft.jtitle=The+Call+%281933-%29&amp;rft.atitle=Monday+Nite+Footballers%3A+Tracy+Cherry%3A+Moving+Up+and+Giving+Back...+Uniquely&amp;rft.au=Nunnelly%2C+Jim&amp;rft.aulast=Nunnelly&amp;rft.aufirst=Jim&amp;rft.date=1987-06-05&amp;rft.volume=&amp;rft.issue=&amp;rft.spage=13&amp;rft.isbn=&amp;rft.btitle=&amp;rft.title=The+Call+%281933-%29&amp;rft.issn=&amp;rft_id=info:doi/,"ProQuest Digital Collections, ProQuest Historical Newspapers: Global, ProQuest Historical Newspapers: Kansas City Call",ProQuestDocuments-2026-01-22(1).xls
Monday Nite Footballers: Perspective On The Hall Of Fame: Perspective On The Hall Of Fame,"For almost a decade 1 have been trying to mo. tivate the Monday Night Footballers to take a trip to Canton, Ohio and participate in the Hall of Fame activities.",2828392819,newspapers,Isaac Gardner-Guest Columnist, Copyright Kansas City Call 1987, Article," Aug 14, 1987", English, English," Kansas City, Missouri","Aug 14, 1987",The Call (1933-),1987,https://www2.lib.ku.edu/login?url=https://www.proquest.com/newspapers/monday-nite-footballers-perspective-on-hall-fame/docview/2828392819/se-2?accountid=14556, 10,https://VV6TT6SY5C.search.serialssolutions.com?ctx_ver=Z39.88-2004&amp;ctx_enc=info:ofi/enc:UTF-8&amp;rfr_id=info:sid/ProQ%3Ahnpkansascitycall&amp;rft_val_fmt=info:ofi/fmt:kev:mtx:journal&amp;rft.genre=article&amp;rft.jtitle=The+Call+%281933-%29&amp;rft.atitle=Monday+Nite+Footballers%3A+Perspective+On+The+Hall+Of+Fame&amp;rft.au=Isaac+Gardner-Guest+Columnist&amp;rft.aulast=Isaac+Gardner-Guest+Columnist&amp;rft.aufirst=&amp;rft.date=1987-08-14&amp;rft.volume=&amp;rft.issue=&amp;rft.spage=10&amp;rft.isbn=&amp;rft.btitle=&amp;rft.title=The+Call+%281933-%29&amp;rft.issn=&amp;rft_id=info:doi/,"ProQuest Digital Collections, ProQuest Historical Newspapers: Global, ProQuest Historical Newspapers: Kansas City Call",ProQuestDocuments-2026-01-22(1).xls
Monday Nite Footballers: The Strike And The Big Numbers: The Strike And The Big Numbers,Seventeen million. Twohundred thirty thousand. Sixty-three thousand.,2828392172,newspapers,"Nunnelly, Jim", Copyright Kansas City Call 1987, Article," Sep 25, 1987", English, English," Kansas City, Missouri","Sep 25, 1987",The Call (1933-),1987,https://www2.lib.ku.edu/login?url=https://www.proquest.com/newspapers/monday-nite-footballers-strike-big-numbers/docview/2828392172/se-2?accountid=14556, 2,https://VV6TT6SY5C.search.serialssolutions.com?ctx_ver=Z39.88-2004&amp;ctx_enc=info:ofi/enc:UTF-8&amp;rfr_id=info:sid/ProQ%3Ahnpkansascitycall&amp;rft_val_fmt=info:ofi/fmt:kev:mtx:journal&amp;rft.genre=article&amp;rft.jtitle=The+Call+%281933-%29&amp;rft.atitle=Monday+Nite+Footballers%3A+The+Strike+And+The+Big+Numbers&amp;rft.au=Nunnelly%2C+Jim&amp;rft.aulast=Nunnelly&amp;rft.aufirst=Jim&amp;rft.date=1987-09-25&amp;rft.volume=&amp;rft.issue=&amp;rft.spage=2&amp;rft.isbn=&amp;rft.btitle=&amp;rft.title=The+Call+%281933-%29&amp;rft.issn=&amp;rft_id=info:doi/,"ProQuest Digital Collections, ProQuest Historical Newspapers: Global, ProQuest Historical Newspapers: Kansas City Call",ProQuestDocuments-2026-01-22(1).xls
Monday Nite Footballers: 39th and Agnes: 'The Clyde Kemp Trail': 39th and Agnes: 'The Clyde Kemp Trail',"""Do not follow where the path may lead. Go instead where there is no path and leave a trail.""",2828378116,newspapers,"Nunnelly, Jim", Copyright Kansas City Call 1986, Article," Jul 25, 1986", English, English," Kansas City, Missouri","Jul 25, 1986",The Call (1933-),1986,https://www2.lib.ku.edu/login?url=https://www.proquest.com/newspapers/monday-nite-footballers-39th-agnes-clyde-kemp/docview/2828378116/se-2?accountid=14556, 14,https://VV6TT6SY5C.search.serialssolutions.com?ctx_ver=Z39.88-2004&amp;ctx_enc=info:ofi/enc:UTF-8&amp;rfr_id=info:sid/ProQ%3Ahnpkansascitycall&amp;rft_val_fmt=info:ofi/fmt:kev:mtx:journal&amp;rft.genre=article&amp;rft.jtitle=The+Call+%281933-%29&amp;rft.atitle=Monday+Nite+Footballers%3A+39th+and+Agnes%3A+%27The+Clyde+Kemp+Trail%27&amp;rft.au=Nunnelly%2C+Jim&amp;rft.aulast=Nunnelly&amp;rft.aufirst=Jim&amp;rft.date=1986-07-25&amp;rft.volume=&amp;rft.issue=&amp;rft.spage=14&amp;rft.isbn=&amp;rft.btitle=&amp;rft.title=The+Call+%281933-%29&amp;rft.issn=&amp;rft_id=info:doi/,"ProQuest Digital Collections, ProQuest Historical Newspapers: Global, ProQuest Historical Newspapers: Kansas City Call",ProQuestDocuments-2026-01-22(1).xls
Monday Nite Footballers: Bobby Sumler: Working. ..Graceful. ..Lucky?: Bobby Sumler: Working. ..Graceful. ..Lucky?,"Diligence may well be the mother of good luck. That old saying is true and may well apply to Bobby Sumler. That's the little floor general from the Washburn Ichabods, winners of the NAIA...",2828375283,newspapers,"Nunnelly, Jim", Copyright Kansas City Call 1987, Article," Mar 20, 1987", English, English," Kansas City, Missouri","Mar 20, 1987",The Call (1933-),1987,https://www2.lib.ku.edu/login?url=https://www.proquest.com/newspapers/monday-nite-footballers-bobby-sumler-working/docview/2828375283/se-2?accountid=14556, 10,https://VV6TT6SY5C.search.serialssolutions.com?ctx_ver=Z39.88-2004&amp;ctx_enc=info:ofi/enc:UTF-8&amp;rfr_id=info:sid/ProQ%3Ahnpkansascitycall&amp;rft_val_fmt=info:ofi/fmt:kev:mtx:journal&amp;rft.genre=article&amp;rft.jtitle=The+Call+%281933-%29&amp;rft.atitle=Monday+Nite+Footballers%3A+Bobby+Sumler%3A+Working.+..Graceful.+..Lucky%3F&amp;rft.au=Nunnelly%2C+Jim&amp;rft.aulast=Nunnelly&amp;rft.aufirst=Jim&amp;rft.date=1987-03-20&amp;rft.volume=&amp;rft.issue=&amp;rft.spage=10&amp;rft.isbn=&amp;rft.btitle=&amp;rft.title=The+Call+%281933-%29&amp;rft.issn=&amp;rft_id=info:doi/,"ProQuest Digital Collections, ProQuest Historical Newspapers: Global, ProQuest Historical Newspapers: Kansas City Call",ProQuestDocuments-2026-01-22(1).xls
Monday Nite Footballers: Rozelle Takes Stand For New Victims: Rozelle Takes Stand For New Victims,"Last week, we promised that we would continue to weigh and balance the use of drugs by professional athletes. And supporting that goal were Paul Booker, Carl Clark, Ollie Hubbard, Jerry Price and Ed West.",2828355894,newspapers,"Nunnelly, Jim", Copyright Kansas City Call 1986, Article," Jul 11, 1986", English, English," Kansas City, Missouri","Jul 11, 1986",The Call (1933-),1986,https://www2.lib.ku.edu/login?url=https://www.proquest.com/newspapers/monday-nite-footballers-rozelle-takes-stand-new/docview/2828355894/se-2?accountid=14556, 21,https://VV6TT6SY5C.search.serialssolutions.com?ctx_ver=Z39.88-2004&amp;ctx_enc=info:ofi/enc:UTF-8&amp;rfr_id=info:sid/ProQ%3Ahnpkansascitycall&amp;rft_val_fmt=info:ofi/fmt:kev:mtx:journal&amp;rft.genre=article&amp;rft.jtitle=The+Call+%281933-%29&amp;rft.atitle=Monday+Nite+Footballers%3A+Rozelle+Takes+Stand+For+New+Victims&amp;rft.au=Nunnelly%2C+Jim&amp;rft.aulast=Nunnelly&amp;rft.aufirst=Jim&amp;rft.date=1986-07-11&amp;rft.volume=&amp;rft.issue=&amp;rft.spage=21&amp;rft.isbn=&amp;rft.btitle=&amp;rft.title=The+Call+%281933-%29&amp;rft.issn=&amp;rft_id=info:doi/,"ProQuest Digital Collections, ProQuest Historical Newspapers: Global, ProQuest Historical Newspapers: Kansas City Call",ProQuestDocuments-2026-01-22(1).xls
Monday Nite Footballers: College Basketball's Three Pointer: Change And Motion: College Basketball's Three Pointer: Change And Motion,"Well, 1986 will be remembered as the ""year of the change in sports"". Ike Gardner and the Monday Niters saw the instant replay become a reality in pro football. And now from Dallas, the NCAA has...",2828349581,newspapers,"Nunnelly, Jim", Copyright Kansas City Call 1986, Article," Apr 11, 1986", English, English," Kansas City, Missouri","Apr 11, 1986",The Call (1933-),1986,https://www2.lib.ku.edu/login?url=https://www.proquest.com/newspapers/monday-nite-footballers-college-basketballs-three/docview/2828349581/se-2?accountid=14556, 14,https://VV6TT6SY5C.search.serialssolutions.com?ctx_ver=Z39.88-2004&amp;ctx_enc=info:ofi/enc:UTF-8&amp;rfr_id=info:sid/ProQ%3Ahnpkansascitycall&amp;rft_val_fmt=info:ofi/fmt:kev:mtx:journal&amp;rft.genre=article&amp;rft.jtitle=The+Call+%281933-%29&amp;rft.atitle=Monday+Nite+Footballers%3A+College+Basketball%27s+Three+Pointer%3A+Change+And+Motion&amp;rft.au=Nunnelly%2C+Jim&amp;rft.aulast=Nunnelly&amp;rft.aufirst=Jim&amp;rft.date=1986-04-11&amp;rft.volume=&amp;rft.issue=&amp;rft.spage=14&amp;rft.isbn=&amp;rft.btitle=&amp;rft.title=The+Call+%281933-%29&amp;rft.issn=&amp;rft_id=info:doi/,"ProQuest Digital Collections, ProQuest Historical Newspapers: Global, ProQuest Historical Newspapers: Kansas City Call",ProQuestDocuments-2026-01-22(1).xls
Monday Nite Footballer Commentary: A Look At Predicted Starters: A Look At Predicted Starters,,2828080191,newspapers,"Nunnelly, Jim", Copyright Kansas City Call 1994, Article," Aug 19, 1994", English, English," Kansas City, Missouri","Aug 19, 1994",The Call (1933-),1994,https://www2.lib.ku.edu/login?url=https://www.proquest.com/newspapers/monday-nite-footballer-commentary-look-at/docview/2828080191/se-2?accountid=14556, 32,https://VV6TT6SY5C.search.serialssolutions.com?ctx_ver=Z39.88-2004&amp;ctx_enc=info:ofi/enc:UTF-8&amp;rfr_id=info:sid/ProQ%3Ahnpkansascitycall&amp;rft_val_fmt=info:ofi/fmt:kev:mtx:journal&amp;rft.genre=article&amp;rft.jtitle=The+Call+%281933-%29&amp;rft.atitle=Monday+Nite+Footballer+Commentary%3A+A+Look+At+Predicted+Starters&amp;rft.au=Nunnelly%2C+Jim&amp;rft.aulast=Nunnelly&amp;rft.aufirst=Jim&amp;rft.date=1994-08-19&amp;rft.volume=&amp;rft.issue=&amp;rft.spage=32&amp;rft.isbn=&amp;rft.btitle=&amp;rft.title=The+Call+%281933-%29&amp;rft.issn=&amp;rft_id=info:doi/,"ProQuest Digital Collections, ProQuest Historical Newspapers: Global, ProQuest Historical Newspapers: Kansas City Call",ProQuestDocuments-2026-01-22(1).xls
Monday Nite Footballers Predictions: Kansas City Chiefs vs. San Francisco Forty-Niners: Kansas City Chiefs vs. San Francisco Forty-Niners,,2828074646,newspapers,"Nunnelly, Jim", Copyright Kansas City Call 1994, Article," Sep 9, 1994", English, English," Kansas City, Missouri","Sep 9, 1994",The Call (1933-),1994,https://www2.lib.ku.edu/login?url=https://www.proquest.com/newspapers/monday-nite-footballers-predictions-kansas-city/docview/2828074646/se-2?accountid=14556, 13,https://VV6TT6SY5C.search.serialssolutions.com?ctx_ver=Z39.88-2004&amp;ctx_enc=info:ofi/enc:UTF-8&amp;rfr_id=info:sid/ProQ%3Ahnpkansascitycall&amp;rft_val_fmt=info:ofi/fmt:kev:mtx:journal&amp;rft.genre=article&amp;rft.jtitle=The+Call+%281933-%29&amp;rft.atitle=Monday+Nite+Footballers+Predictions%3A+Kansas+City+Chiefs+vs.+San+Francisco+Forty-Niners&amp;rft.au=Nunnelly%2C+Jim&amp;rft.aulast=Nunnelly&amp;rft.aufirst=Jim&amp;rft.date=1994-09-09&amp;rft.volume=&amp;rft.issue=&amp;rft.spage=13&amp;rft.isbn=&amp;rft.btitle=&amp;rft.title=The+Call+%281933-%29&amp;rft.issn=&amp;rft_id=info:doi/,"ProQuest Digital Collections, ProQuest Historical Newspapers: Global, ProQuest Historical Newspapers: Kansas City Call",ProQuestDocuments-2026-01-22(1).xls
Monday Nite Footballer Predictions: Los Angeles Raiders vs. Kansas City Chiefs: Los Angeles Raiders vs. Kansas City Chiefs,,2826519388,newspapers,"Nunnelly, Jim", Copyright Kansas City Call 1994, Article," Nov 4, 1994", English, English," Kansas City, Missouri","Nov 4, 1994",The Call (1933-),1994,https://www2.lib.ku.edu/login?url=https://www.proquest.com/newspapers/monday-nite-footballer-predictions-los-angeles/docview/2826519388/se-2?accountid=14556, 17,https://VV6TT6SY5C.search.serialssolutions.com?ctx_ver=Z39.88-2004&amp;ctx_enc=info:ofi/enc:UTF-8&amp;rfr_id=info:sid/ProQ%3Ahnpkansascitycall&amp;rft_val_fmt=info:ofi/fmt:kev:mtx:journal&amp;rft.genre=article&amp;rft.jtitle=The+Call+%281933-%29&amp;rft.atitle=Monday+Nite+Footballer+Predictions%3A+Los+Angeles+Raiders+vs.+Kansas+City+Chiefs&amp;rft.au=Nunnelly%2C+Jim&amp;rft.aulast=Nunnelly&amp;rft.aufirst=Jim&amp;rft.date=1994-11-04&amp;rft.volume=&amp;rft.issue=&amp;rft.spage=17&amp;rft.isbn=&amp;rft.btitle=&amp;rft.title=The+Call+%281933-%29&amp;rft.issn=&amp;rft_id=info:doi/,"ProQuest Digital Collections, ProQuest Historical Newspapers: Global, ProQuest Historical Newspapers: Kansas City Call",ProQuestDocuments-2026-01-22(1).xls
"Monday Nite Footballers: Lynette Woodard, The First Woman Globetrotter: Lynette Woodard, The First Woman Globetrotter","While it may seem strange that the Monday Nite Footballers would be writing about a basketball player right in the middle of the Super Bowl Playoffs, our interests in athletics and academics is well...",2826495565,newspapers,"Nunnelly, Jim", Copyright Kansas City Call 1986, Article," Jan 17, 1986", English, English," Kansas City, Missouri","Jan 17, 1986",The Call (1933-),1986,https://www2.lib.ku.edu/login?url=https://www.proquest.com/newspapers/monday-nite-footballers-lynette-woodard-first/docview/2826495565/se-2?accountid=14556, 13,https://VV6TT6SY5C.search.serialssolutions.com?ctx_ver=Z39.88-2004&amp;ctx_enc=info:ofi/enc:UTF-8&amp;rfr_id=info:sid/ProQ%3Ahnpkansascitycall&amp;rft_val_fmt=info:ofi/fmt:kev:mtx:journal&amp;rft.genre=article&amp;rft.jtitle=The+Call+%281933-%29&amp;rft.atitle=Monday+Nite+Footballers%3A+Lynette+Woodard%2C+The+First+Woman+Globetrotter&amp;rft.au=Nunnelly%2C+Jim&amp;rft.aulast=Nunnelly&amp;rft.aufirst=Jim&amp;rft.date=1986-01-17&amp;rft.volume=&amp;rft.issue=&amp;rft.spage=13&amp;rft.isbn=&amp;rft.btitle=&amp;rft.title=The+Call+%281933-%29&amp;rft.issn=&amp;rft_id=info:doi/,"ProQuest Digital Collections, ProQuest Historical Newspapers: Global, ProQuest Historical Newspapers: Kansas City Call",ProQuestDocuments-2026-01-22(1).xls
Monday Nite Footballers Commentary: Brian Tobey: Full of Roots: Brian Tobey: Full of Roots,"When Alex Haley wrote Roots, he was telling us that the farther we can trace our family tree, the better our chances are becoming successful.",2826488249,newspapers,"Nunnelly, Jim", Copyright Kansas City Call 1989, Article," Apr 28, 1989", English, English," Kansas City, Missouri","Apr 28, 1989",The Call (1933-),1989,https://www2.lib.ku.edu/login?url=https://www.proquest.com/newspapers/monday-nite-footballers-commentary-brian-tobey/docview/2826488249/se-2?accountid=14556, 19,https://VV6TT6SY5C.search.serialssolutions.com?ctx_ver=Z39.88-2004&amp;ctx_enc=info:ofi/enc:UTF-8&amp;rfr_id=info:sid/ProQ%3Ahnpkansascitycall&amp;rft_val_fmt=info:ofi/fmt:kev:mtx:journal&amp;rft.genre=article&amp;rft.jtitle=The+Call+%281933-%29&amp;rft.atitle=Monday+Nite+Footballers+Commentary%3A+Brian+Tobey%3A+Full+of+Roots&amp;rft.au=Nunnelly%2C+Jim&amp;rft.aulast=Nunnelly&amp;rft.aufirst=Jim&amp;rft.date=1989-04-28&amp;rft.volume=&amp;rft.issue=&amp;rft.spage=19&amp;rft.isbn=&amp;rft.btitle=&amp;rft.title=The+Call+%281933-%29&amp;rft.issn=&amp;rft_id=info:doi/,"ProQuest Digital Collections, ProQuest Historical Newspapers: Global, ProQuest Historical Newspapers: Kansas City Call",ProQuestDocuments-2026-01-22(1).xls
Monday Nite Footballers Commentary: Super Bowl Sideline: Past And Present: Super Bowl Sideline: Past And Present,"It was January 15, 1967 and Super Bowl I was about to begin. The Green Bay Packers and the Kansas City Chiefs would battle for the first championship crown. The National Football League and the...",2826407021,newspapers,"West, Ed", Copyright Kansas City Call 1988, Article," Jan 29, 1988", English, English," Kansas City, Missouri","Jan 29, 1988",The Call (1933-),1988,https://www2.lib.ku.edu/login?url=https://www.proquest.com/newspapers/monday-nite-footballers-commentary-super-bowl/docview/2826407021/se-2?accountid=14556, 11,https://VV6TT6SY5C.search.serialssolutions.com?ctx_ver=Z39.88-2004&amp;ctx_enc=info:ofi/enc:UTF-8&amp;rfr_id=info:sid/ProQ%3Ahnpkansascitycall&amp;rft_val_fmt=info:ofi/fmt:kev:mtx:journal&amp;rft.genre=article&amp;rft.jtitle=The+Call+%281933-%29&amp;rft.atitle=Monday+Nite+Footballers+Commentary%3A+Super+Bowl+Sideline%3A+Past+And+Present&amp;rft.au=West%2C+Ed&amp;rft.aulast=West&amp;rft.aufirst=Ed&amp;rft.date=1988-01-29&amp;rft.volume=&amp;rft.issue=&amp;rft.spage=11&amp;rft.isbn=&amp;rft.btitle=&amp;rft.title=The+Call+%281933-%29&amp;rft.issn=&amp;rft_id=info:doi/,"ProQuest Digital Collections, ProQuest Historical Newspapers: Global, ProQuest Historical Newspapers: Kansas City Call",ProQuestDocuments-2026-01-22(1).xls
Monday Nite Footballers: Commentary; Doug Williams: Testing His Limits And Succeeding: Commentary; Doug Williams: Testing His Limits And Succeeding,"To dream anything that you want to dream. That is the beauty of the human mind. To do anything that you want to do. That is the strength of the human will. To trust in yourself, to test you limits. That...",2826402426,newspapers,"Nunnelly, Jim", Copyright Kansas City Call 1988, Article," Jan 15, 1988", English, English," Kansas City, Missouri","Jan 15, 1988",The Call (1933-),1988,https://www2.lib.ku.edu/login?url=https://www.proquest.com/newspapers/monday-nite-footballers-commentary-doug-williams/docview/2826402426/se-2?accountid=14556, 12,https://VV6TT6SY5C.search.serialssolutions.com?ctx_ver=Z39.88-2004&amp;ctx_enc=info:ofi/enc:UTF-8&amp;rfr_id=info:sid/ProQ%3Ahnpkansascitycall&amp;rft_val_fmt=info:ofi/fmt:kev:mtx:journal&amp;rft.genre=article&amp;rft.jtitle=The+Call+%281933-%29&amp;rft.atitle=Monday+Nite+Footballers%3A+Commentary%3B+Doug+Williams%3A+Testing+His+Limits+And+Succeeding&amp;rft.au=Nunnelly%2C+Jim&amp;rft.aulast=Nunnelly&amp;rft.aufirst=Jim&amp;rft.date=1988-01-15&amp;rft.volume=&amp;rft.issue=&amp;rft.spage=12&amp;rft.isbn=&amp;rft.btitle=&amp;rft.title=The+Call+%281933-%29&amp;rft.issn=&amp;rft_id=info:doi/,"ProQuest Digital Collections, ProQuest Historical Newspapers: Global, ProQuest Historical Newspapers: Kansas City Call",ProQuestDocuments-2026-01-22(1).xls
Monday Nite Footballers Commentary: NAIA: Will The Real Johnny Miller Speak Up?: NAIA: Will The Real Johnny Miller Speak Up?,"1972. That year makes Johnny Miller speak up. And, when he talks about that year, he smiles. He gives you a I-will-correct-you look, if he thinks you do not have the facts about 1972. Usually, Johnny...",2826180998,newspapers,"Nunnelly, Jim", Copyright Kansas City Call 1989, Article," Mar 24, 1989", English, English," Kansas City, Missouri","Mar 24, 1989",The Call (1933-),1989,https://www2.lib.ku.edu/login?url=https://www.proquest.com/newspapers/monday-nite-footballers-commentary-naia-will-real/docview/2826180998/se-2?accountid=14556, 13,https://VV6TT6SY5C.search.serialssolutions.com?ctx_ver=Z39.88-2004&amp;ctx_enc=info:ofi/enc:UTF-8&amp;rfr_id=info:sid/ProQ%3Ahnpkansascitycall&amp;rft_val_fmt=info:ofi/fmt:kev:mtx:journal&amp;rft.genre=article&amp;rft.jtitle=The+Call+%281933-%29&amp;rft.atitle=Monday+Nite+Footballers+Commentary%3A+NAIA%3A+Will+The+Real+Johnny+Miller+Speak+Up%3F&amp;rft.au=Nunnelly%2C+Jim&amp;rft.aulast=Nunnelly&amp;rft.aufirst=Jim&amp;rft.date=1989-03-24&amp;rft.volume=&amp;rft.issue=&amp;rft.spage=13&amp;rft.isbn=&amp;rft.btitle=&amp;rft.title=The+Call+%281933-%29&amp;rft.issn=&amp;rft_id=info:doi/,"ProQuest Digital Collections, ProQuest Historical Newspapers: Global, ProQuest Historical Newspapers: Kansas City Call",ProQuestDocuments-2026-01-22(1).xls
Monday Nite Footballers: Commentary; Necessary Progress: College Football Super Bowl?: Commentary; Necessary Progress: College Football Super Bowl?,"""Progress begins with the belief that what is necessary is possible.""",2826100622,newspapers,"Nunnelly, Jim", Copyright Kansas City Call 1987, Article," Mar 13, 1987", English, English," Kansas City, Missouri","Mar 13, 1987",The Call (1933-),1987,https://www2.lib.ku.edu/login?url=https://www.proquest.com/newspapers/monday-nite-footballers-commentary-necessary/docview/2826100622/se-2?accountid=14556, 9,https://VV6TT6SY5C.search.serialssolutions.com?ctx_ver=Z39.88-2004&amp;ctx_enc=info:ofi/enc:UTF-8&amp;rfr_id=info:sid/ProQ%3Ahnpkansascitycall&amp;rft_val_fmt=info:ofi/fmt:kev:mtx:journal&amp;rft.genre=article&amp;rft.jtitle=The+Call+%281933-%29&amp;rft.atitle=Monday+Nite+Footballers%3A+Commentary%3B+Necessary+Progress%3A+College+Football+Super+Bowl%3F&amp;rft.au=Nunnelly%2C+Jim&amp;rft.aulast=Nunnelly&amp;rft.aufirst=Jim&amp;rft.date=1987-03-13&amp;rft.volume=&amp;rft.issue=&amp;rft.spage=9&amp;rft.isbn=&amp;rft.btitle=&amp;rft.title=The+Call+%281933-%29&amp;rft.issn=&amp;rft_id=info:doi/,"ProQuest Digital Collections, ProQuest Historical Newspapers: Global, ProQuest Historical Newspapers: Kansas City Call",ProQuestDocuments-2026-01-22(1).xls
Monday Nite Footballers Commentary: The Texas 'No Pass-No Play' Law: The Texas 'No Pass-No Play' Law,"The state of Texas has a law concerning where athletics stand In the high school. The law is called the ""no pass, no play"" law. Simply stated, if a student wants to participate In extracurricular activities,...",2826089639,newspapers,"Nunnelly, Jim", Copyright Kansas City Call 1985, Article," Dec 6, 1985", English, English," Kansas City, Missouri","Dec 6, 1985",The Call (1933-),1985,https://www2.lib.ku.edu/login?url=https://www.proquest.com/newspapers/monday-nite-footballers-commentary-texas-no-pass/docview/2826089639/se-2?accountid=14556, 14,https://VV6TT6SY5C.search.serialssolutions.com?ctx_ver=Z39.88-2004&amp;ctx_enc=info:ofi/enc:UTF-8&amp;rfr_id=info:sid/ProQ%3Ahnpkansascitycall&amp;rft_val_fmt=info:ofi/fmt:kev:mtx:journal&amp;rft.genre=article&amp;rft.jtitle=The+Call+%281933-%29&amp;rft.atitle=Monday+Nite+Footballers+Commentary%3A+The+Texas+%27No+Pass-No+Play%27+Law&amp;rft.au=Nunnelly%2C+Jim&amp;rft.aulast=Nunnelly&amp;rft.aufirst=Jim&amp;rft.date=1985-12-06&amp;rft.volume=&amp;rft.issue=&amp;rft.spage=14&amp;rft.isbn=&amp;rft.btitle=&amp;rft.title=The+Call+%281933-%29&amp;rft.issn=&amp;rft_id=info:doi/,"ProQuest Digital Collections, ProQuest Historical Newspapers: Global, ProQuest Historical Newspapers: Kansas City Call",ProQuestDocuments-2026-01-22(1).xls
Monday Nite Footballers Predictions: K.C. FINISHES REGULAR SEASON AT 13-3: K.C. FINISHES REGULAR SEASON AT 13-3,,2825947653,newspapers,"Jim ""Grand Dad"" Nunnelly", Copyright Kansas City Call 2004, Article," Jan 2, 2004", English, English," Kansas City, Missouri","Jan 2, 2004",The Call (1933-),2004,https://www2.lib.ku.edu/login?url=https://www.proquest.com/newspapers/monday-nite-footballers-predictions-k-c-finishes/docview/2825947653/se-2?accountid=14556, 10,https://VV6TT6SY5C.search.serialssolutions.com?ctx_ver=Z39.88-2004&amp;ctx_enc=info:ofi/enc:UTF-8&amp;rfr_id=info:sid/ProQ%3Ahnpkansascitycall&amp;rft_val_fmt=info:ofi/fmt:kev:mtx:journal&amp;rft.genre=article&amp;rft.jtitle=The+Call+%281933-%29&amp;rft.atitle=Monday+Nite+Footballers+Predictions%3A+K.C.+FINISHES+REGULAR+SEASON+AT+13-3&amp;rft.au=Jim+%22Grand+Dad%22+Nunnelly&amp;rft.aulast=Jim+%22Grand+Dad%22+Nunnelly&amp;rft.aufirst=&amp;rft.date=2004-01-02&amp;rft.volume=&amp;rft.issue=&amp;rft.spage=10&amp;rft.isbn=&amp;rft.btitle=&amp;rft.title=The+Call+%281933-%29&amp;rft.issn=&amp;rft_id=info:doi/,"ProQuest Digital Collections, ProQuest Historical Newspapers: Global, ProQuest Historical Newspapers: Kansas City Call",ProQuestDocuments-2026-01-22(1).xls
